{"schemaVersion":1,"lang":"en","id":"en-l1-p02-17","kind":"pack","level":1,"pack":{"id":"en-l1-p02","index":17},"grid":{"rows":9,"cols":7,"colOrigin":"readingStart"},"layout":["CLCCCCC","CLLLLLL","CLLLLLL","CCLLLLL","LLLLCCC","CCCLLLL","LLLCLLL","CLLLLLL","LLLCLLL"],"clueCells":[{"r":0,"c":0,"slots":[{"pos":"full","wordId":"d01","arrow":"AD","text":"noise","lines":["noise"]}]},{"r":0,"c":2,"slots":[{"pos":"full","wordId":"d03","arrow":"D","text":"girl","lines":["girl"]}]},{"r":0,"c":3,"slots":[{"pos":"full","wordId":"d05","arrow":"D","text":"quality","lines":["quality"]}]},{"r":0,"c":4,"slots":[{"pos":"full","wordId":"d06","arrow":"D","text":"particle","lines":["particle"]}]},{"r":0,"c":5,"slots":[{"pos":"full","wordId":"d08","arrow":"D","text":"second day of the week","lines":["second","day of","the week"]}]},{"r":0,"c":6,"slots":[{"pos":"full","wordId":"d10","arrow":"D","text":"whatever","lines":["whatever"]}]},{"r":1,"c":0,"slots":[{"pos":"full","wordId":"a01","arrow":"A","text":"syllable","lines":["syllable"]}]},{"r":2,"c":0,"slots":[{"pos":"full","wordId":"a02","arrow":"A","text":"exploding firework","lines":["exploding","firework"]}]},{"r":3,"c":0,"slots":[{"pos":"full","wordId":"a04","arrow":"DA","text":"unusually great","lines":["unusually","great"]}]},{"r":3,"c":1,"slots":[{"pos":"full","wordId":"a03","arrow":"A","text":"bright and pleasant","lines":["bright","and","pleasant"]}]},{"r":4,"c":4,"slots":[{"pos":"full","wordId":"d07","arrow":"D","text":"at or from or","lines":["at or","from or"]}]},{"r":4,"c":5,"slots":[{"pos":"full","wordId":"d09","arrow":"D","text":"article","lines":["article"]}]},{"r":4,"c":6,"slots":[{"pos":"full","wordId":"d11","arrow":"D","text":"plain","lines":["plain"]}]},{"r":5,"c":0,"slots":[{"pos":"full","wordId":"a06","arrow":"DA","text":"shanty","lines":["shanty"]}]},{"r":5,"c":1,"slots":[{"pos":"full","wordId":"d02","arrow":"D","text":"influence","lines":["influence"]}]},{"r":5,"c":2,"slots":[{"pos":"top","wordId":"a05","arrow":"A","text":"diurnal bird","lines":["diurnal","bird"]},{"pos":"bottom","wordId":"d04","arrow":"D","text":"make lacework","lines":["make","lacework"]}]},{"r":6,"c":3,"slots":[{"pos":"full","wordId":"a07","arrow":"A","text":"follower","lines":["follower"]}]},{"r":7,"c":0,"slots":[{"pos":"top","wordId":"a08","arrow":"A","text":"campaign","lines":["campaign"]},{"pos":"bottom","wordId":"a09","arrow":"DA","text":"moisture","lines":["moisture"]}]},{"r":8,"c":3,"slots":[{"pos":"full","wordId":"a10","arrow":"A","text":"place in liquid so as","lines":["place in","liquid so","as"]}]}],"words":[{"id":"a01","dir":"A","start":{"r":1,"c":1},"len":6,"clueCell":{"r":1,"c":0},"arrow":"A","clueId":"ec_31690812c2ef","lemmaId":"ew_47584bad90","wordCount":1,"difficulty":0.372},{"id":"a02","dir":"A","start":{"r":2,"c":1},"len":6,"clueCell":{"r":2,"c":0},"arrow":"A","clueId":"ec_9100afc79c47","lemmaId":"ew_51f297a7e4","wordCount":1,"difficulty":0.342},{"id":"a03","dir":"A","start":{"r":3,"c":2},"len":5,"clueCell":{"r":3,"c":1},"arrow":"A","clueId":"ec_b2d9e2beb1e5","lemmaId":"ew_b892f06792","wordCount":1,"difficulty":0.243},{"id":"a04","dir":"A","start":{"r":4,"c":0},"len":4,"clueCell":{"r":3,"c":0},"arrow":"DA","clueId":"ec_618f9141b38f","lemmaId":"ew_6a7ebfc5e0","wordCount":1,"difficulty":0.2},{"id":"a05","dir":"A","start":{"r":5,"c":3},"len":4,"clueCell":{"r":5,"c":2},"arrow":"A","clueId":"ec_6fc9093646ff","lemmaId":"ew_62fac2f438","wordCount":1,"difficulty":0.227},{"id":"a06","dir":"A","start":{"r":6,"c":0},"len":3,"clueCell":{"r":5,"c":0},"arrow":"DA","clueId":"ec_78dac4f70aec","lemmaId":"ew_00020d3566","wordCount":1,"difficulty":0.228},{"id":"a07","dir":"A","start":{"r":6,"c":4},"len":3,"clueCell":{"r":6,"c":3},"arrow":"A","clueId":"ec_0694165a5818","lemmaId":"ew_2899441143","wordCount":1,"difficulty":0.12},{"id":"a08","dir":"A","start":{"r":7,"c":1},"len":6,"clueCell":{"r":7,"c":0},"arrow":"A","clueId":"ec_2e3a86ebce15","lemmaId":"ew_40102dbf90","wordCount":1,"difficulty":0.243},{"id":"a09","dir":"A","start":{"r":8,"c":0},"len":3,"clueCell":{"r":7,"c":0},"arrow":"DA","clueId":"ec_179dd0237d65","lemmaId":"ew_c8e275e6d1","wordCount":1,"difficulty":0.141},{"id":"a10","dir":"A","start":{"r":8,"c":4},"len":3,"clueCell":{"r":8,"c":3},"arrow":"A","clueId":"ec_27ba45270df3","lemmaId":"ew_41217c2fc7","wordCount":1,"difficulty":0.217},{"id":"d01","dir":"D","start":{"r":0,"c":1},"len":3,"clueCell":{"r":0,"c":0},"arrow":"AD","clueId":"ec_8fed478f88a5","lemmaId":"ew_39c9940833","wordCount":1,"difficulty":0.236},{"id":"d02","dir":"D","start":{"r":6,"c":1},"len":3,"clueCell":{"r":5,"c":1},"arrow":"D","clueId":"ec_3bf056148152","lemmaId":"ew_04489a12bb","wordCount":1,"difficulty":0.057},{"id":"d03","dir":"D","start":{"r":1,"c":2},"len":4,"clueCell":{"r":0,"c":2},"arrow":"D","clueId":"ec_cc692bf7cce1","lemmaId":"ew_179d278234","wordCount":1,"difficulty":0.383},{"id":"d04","dir":"D","start":{"r":6,"c":2},"len":3,"clueCell":{"r":5,"c":2},"arrow":"D","clueId":"ec_d404d150cf97","lemmaId":"ew_3811d14d3b","wordCount":1,"difficulty":0.28},{"id":"d05","dir":"D","start":{"r":1,"c":3},"len":5,"clueCell":{"r":0,"c":3},"arrow":"D","clueId":"ec_018e9730818a","lemmaId":"ew_45fa151bf9","wordCount":1,"difficulty":0.195},{"id":"d06","dir":"D","start":{"r":1,"c":4},"len":3,"clueCell":{"r":0,"c":4},"arrow":"D","clueId":"ec_246a3d38c96f","lemmaId":"ew_bbb2864794","wordCount":1,"difficulty":0.166},{"id":"d07","dir":"D","start":{"r":5,"c":4},"len":4,"clueCell":{"r":4,"c":4},"arrow":"D","clueId":"ec_36f7ce255eaf","lemmaId":"ew_a1fc69cd46","wordCount":1,"difficulty":0.371},{"id":"d08","dir":"D","start":{"r":1,"c":5},"len":3,"clueCell":{"r":0,"c":5},"arrow":"D","clueId":"ec_fd33bf351d81","lemmaId":"ew_33febd43e8","wordCount":1,"difficulty":0.107},{"id":"d09","dir":"D","start":{"r":5,"c":5},"len":4,"clueCell":{"r":4,"c":5},"arrow":"D","clueId":"ec_f407793a3091","lemmaId":"ew_70dfa644b1","wordCount":1,"difficulty":0.238},{"id":"d10","dir":"D","start":{"r":1,"c":6},"len":3,"clueCell":{"r":0,"c":6},"arrow":"D","clueId":"ec_d2ea227dc4fb","lemmaId":"ew_c5fe0200d1","wordCount":1,"difficulty":0.057},{"id":"d11","dir":"D","start":{"r":5,"c":6},"len":4,"clueCell":{"r":4,"c":6},"arrow":"D","clueId":"ec_5fd7e92ef92a","lemmaId":"ew_668166eff7","wordCount":1,"difficulty":0.24}],"solution":{"enc":"xor1","data":"C/AFPRW7eHzx16St5TH2F292iPByBIWfgGKJZI5vrxd8qg3FgDiDoMNmk1g="},"difficulty":{"score":29.9,"band":"easy","features":{"meanWordDiff":0.222,"p90WordDiff":0.371,"meanClueDiff":0.492,"wordCount":21.0,"avgLen":3.905,"checkedRatio":0.864,"properShare":0.0,"multiwordShare":0.0,"bentArrows":4.0,"twoLetterShare":0.0,"uncheckedLetters":6.0}},"meta":{"generator":{"version":"0.2.1","seed":"8905c7c73d833a1e313faed1ad99635d","templateId":"en-t1-005","dictSnapshot":"en-9280a7165b"},"author":"generator","createdAt":"2026-10-29T10:02:35.160843Z","version":1,"checksum":"sha256:f788306bfad16c01ca78728ea1ad1a0465b089bbb2a7aee31395c0e200a48dd9"}}