{"schemaVersion":1,"lang":"he","id":"he-l2-p03-23","kind":"pack","level":2,"pack":{"id":"he-l2-p03","index":23},"grid":{"rows":10,"cols":8,"colOrigin":"readingStart"},"layout":["CLCCLLCL","CLLLLCLL","CLLCLCCL","CLLLLLLL","CLLLCLLC","CLLLCLLL","CCCLCLCL","LLLLLLLC","CLLLLLLL","CLLLLLLL"],"clueCells":[{"r":0,"c":0,"slots":[{"pos":"full","wordId":"d01","arrow":"AD","text":"מן תוכי גדול","lines":["מן תוכי","גדול"]}]},{"r":0,"c":2,"slots":[{"pos":"full","wordId":"d03","arrow":"D","text":"הקו הכי קטן","lines":["הקו הכי","קטן"]}]},{"r":0,"c":3,"slots":[{"pos":"top","wordId":"a01","arrow":"A","text":"עיר בצרפת","lines":["עיר בצרפת"]},{"pos":"bottom","wordId":"d06","arrow":"AD","text":"הביע שמחה","lines":["הביע שמחה"]}]},{"r":0,"c":6,"slots":[{"pos":"full","wordId":"d11","arrow":"AD","text":"בן המקום","lines":["בן המקום"]}]},{"r":1,"c":0,"slots":[{"pos":"full","wordId":"a02","arrow":"A","text":"ממקשי המקלדת","lines":["ממקשי","המקלדת"]}]},{"r":1,"c":5,"slots":[{"pos":"full","wordId":"a03","arrow":"A","text":"הדבר בשלמותו","lines":["הדבר","בשלמותו"]}]},{"r":2,"c":0,"slots":[{"pos":"full","wordId":"a04","arrow":"A","text":"קריה קדושה","lines":["קריה","קדושה"]}]},{"r":2,"c":3,"slots":[{"pos":"full","wordId":"d05","arrow":"D","text":"משפחת צמחים","lines":["משפחת","צמחים"]}]},{"r":2,"c":5,"slots":[{"pos":"full","wordId":"d08","arrow":"D","text":"נוזל צמיג חסר צבע וריח","lines":["נוזל צמיג","חסר צבע","וריח"]}]},{"r":2,"c":6,"slots":[{"pos":"full","wordId":"d09","arrow":"D","text":"הוביל עדר","lines":["הוביל עדר"]}]},{"r":3,"c":0,"slots":[{"pos":"full","wordId":"a05","arrow":"A","text":"זרם מוזיקלי","lines":["זרם","מוזיקלי"]}]},{"r":4,"c":0,"slots":[{"pos":"full","wordId":"a06","arrow":"A","text":"שטיחון ליד המיטה","lines":["שטיחון","ליד המיטה"]}]},{"r":4,"c":4,"slots":[{"pos":"full","wordId":"a07","arrow":"A","text":"מחלקי הפה ענבל","lines":["מחלקי","הפה ענבל"]}]},{"r":4,"c":7,"slots":[{"pos":"full","wordId":"d12","arrow":"D","text":"צבע חום בהיר","lines":["צבע חום","בהיר"]}]},{"r":5,"c":0,"slots":[{"pos":"full","wordId":"a08","arrow":"A","text":"את בסופה","lines":["את בסופה"]}]},{"r":5,"c":4,"slots":[{"pos":"full","wordId":"a09","arrow":"A","text":"בן יששכר","lines":["בן יששכר"]}]},{"r":6,"c":0,"slots":[{"pos":"full","wordId":"a10","arrow":"DA","text":"ממשחקי המחבט","lines":["ממשחקי","המחבט"]}]},{"r":6,"c":1,"slots":[{"pos":"full","wordId":"d02","arrow":"D","text":"מקווה מים גדול","lines":["מקווה מים","גדול"]}]},{"r":6,"c":2,"slots":[{"pos":"full","wordId":"d04","arrow":"D","text":"משמשים מיובשים","lines":["משמשים","מיובשים"]}]},{"r":6,"c":4,"slots":[{"pos":"full","wordId":"d07","arrow":"D","text":"אל שומרי","lines":["אל שומרי"]}]},{"r":6,"c":6,"slots":[{"pos":"full","wordId":"d10","arrow":"D","text":"מחוש","lines":["מחוש"]}]},{"r":7,"c":7,"slots":[{"pos":"full","wordId":"d13","arrow":"D","text":"מאכל מתוק","lines":["מאכל","מתוק"]}]},{"r":8,"c":0,"slots":[{"pos":"full","wordId":"a11","arrow":"A","text":"פוליטיקה","lines":["פוליטיקה"]}]},{"r":9,"c":0,"slots":[{"pos":"full","wordId":"a12","arrow":"A","text":"תואם צלילים","lines":["תואם","צלילים"]}]}],"words":[{"id":"a01","dir":"A","start":{"r":0,"c":4},"len":2,"clueCell":{"r":0,"c":3},"arrow":"A","clueId":"hc_c9a3a27ad7c5","lemmaId":"hw_1aee74043f","wordCount":1,"difficulty":0.103},{"id":"a02","dir":"A","start":{"r":1,"c":1},"len":4,"clueCell":{"r":1,"c":0},"arrow":"A","clueId":"hc_9f5693fe61ff","lemmaId":"hw_0cb54cfbec","wordCount":1,"difficulty":0.542},{"id":"a03","dir":"A","start":{"r":1,"c":6},"len":2,"clueCell":{"r":1,"c":5},"arrow":"A","clueId":"hc_9793d3e86a5c","lemmaId":"hw_9a903f8da6","wordCount":1,"difficulty":0.23},{"id":"a04","dir":"A","start":{"r":2,"c":1},"len":2,"clueCell":{"r":2,"c":0},"arrow":"A","clueId":"hc_ecb7b2551f2c","lemmaId":"hw_3a80436b77","wordCount":1,"difficulty":0.514},{"id":"a05","dir":"A","start":{"r":3,"c":1},"len":7,"clueCell":{"r":3,"c":0},"arrow":"A","clueId":"hc_7596f2c1bfd9","lemmaId":"hw_56c34d9720","wordCount":1,"difficulty":0.341},{"id":"a06","dir":"A","start":{"r":4,"c":1},"len":3,"clueCell":{"r":4,"c":0},"arrow":"A","clueId":"hc_d24188505b96","lemmaId":"hw_2a991ce82b","wordCount":1,"difficulty":0.283},{"id":"a07","dir":"A","start":{"r":4,"c":5},"len":2,"clueCell":{"r":4,"c":4},"arrow":"A","clueId":"hc_d3a137959ac6","lemmaId":"hw_562168c125","wordCount":1,"difficulty":0.141},{"id":"a08","dir":"A","start":{"r":5,"c":1},"len":3,"clueCell":{"r":5,"c":0},"arrow":"A","clueId":"hc_5b286a5e9c0d","lemmaId":"hw_d09c59524a","wordCount":1,"difficulty":0.38},{"id":"a09","dir":"A","start":{"r":5,"c":5},"len":3,"clueCell":{"r":5,"c":4},"arrow":"A","clueId":"hc_64808ed9629e","lemmaId":"hw_6826153530","wordCount":1,"difficulty":0.283},{"id":"a10","dir":"A","start":{"r":7,"c":0},"len":7,"clueCell":{"r":6,"c":0},"arrow":"DA","clueId":"hc_0366849e2486","lemmaId":"hw_c5cf557d39","wordCount":1,"difficulty":0.306},{"id":"a11","dir":"A","start":{"r":8,"c":1},"len":7,"clueCell":{"r":8,"c":0},"arrow":"A","clueId":"hc_dafb0a27dd26","lemmaId":"hw_fbe5810854","wordCount":1,"difficulty":0.394},{"id":"a12","dir":"A","start":{"r":9,"c":1},"len":7,"clueCell":{"r":9,"c":0},"arrow":"A","clueId":"hc_0658750e83bf","lemmaId":"hw_3a517395c4","wordCount":1,"difficulty":0.283},{"id":"d01","dir":"D","start":{"r":0,"c":1},"len":6,"clueCell":{"r":0,"c":0},"arrow":"AD","clueId":"hc_757d1145343f","lemmaId":"hw_c5663aa205","wordCount":1,"difficulty":0.313},{"id":"d02","dir":"D","start":{"r":7,"c":1},"len":3,"clueCell":{"r":6,"c":1},"arrow":"D","clueId":"hc_c4a413c3eebb","lemmaId":"hw_60aaa76791","wordCount":1,"difficulty":0.23},{"id":"d03","dir":"D","start":{"r":1,"c":2},"len":5,"clueCell":{"r":0,"c":2},"arrow":"D","clueId":"hc_18110caefcc0","lemmaId":"hw_c4124e670c","wordCount":1,"difficulty":0.286},{"id":"d04","dir":"D","start":{"r":7,"c":2},"len":3,"clueCell":{"r":6,"c":2},"arrow":"D","clueId":"hc_152db85d3aac","lemmaId":"hw_1d1c4c2675","wordCount":1,"difficulty":0.172},{"id":"d05","dir":"D","start":{"r":3,"c":3},"len":7,"clueCell":{"r":2,"c":3},"arrow":"D","clueId":"hc_637622a83919","lemmaId":"hw_91bedeaeda","wordCount":1,"difficulty":0.491},{"id":"d06","dir":"D","start":{"r":0,"c":4},"len":4,"clueCell":{"r":0,"c":3},"arrow":"AD","clueId":"hc_876e237466f0","lemmaId":"hw_e29942b01c","wordCount":1,"difficulty":0.408},{"id":"d07","dir":"D","start":{"r":7,"c":4},"len":3,"clueCell":{"r":6,"c":4},"arrow":"D","clueId":"hc_2773308f0835","lemmaId":"hw_1ca950a441","wordCount":1,"difficulty":0.38},{"id":"d08","dir":"D","start":{"r":3,"c":5},"len":7,"clueCell":{"r":2,"c":5},"arrow":"D","clueId":"hc_3a3124279f6c","lemmaId":"hw_6f4c6d946f","wordCount":1,"difficulty":0.283},{"id":"d09","dir":"D","start":{"r":3,"c":6},"len":3,"clueCell":{"r":2,"c":6},"arrow":"D","clueId":"hc_5f4af3359501","lemmaId":"hw_4975aa8263","wordCount":1,"difficulty":0.23},{"id":"d10","dir":"D","start":{"r":7,"c":6},"len":3,"clueCell":{"r":6,"c":6},"arrow":"D","clueId":"hc_534927684b41","lemmaId":"hw_9d412b6fdf","wordCount":1,"difficulty":0.38},{"id":"d11","dir":"D","start":{"r":0,"c":7},"len":4,"clueCell":{"r":0,"c":6},"arrow":"AD","clueId":"hc_eb49b08fe7d2","lemmaId":"hw_d345773ba3","wordCount":1,"difficulty":0.311},{"id":"d12","dir":"D","start":{"r":5,"c":7},"len":2,"clueCell":{"r":4,"c":7},"arrow":"D","clueId":"hc_04ce28c9584e","lemmaId":"hw_796504fc5c","wordCount":1,"difficulty":0.333},{"id":"d13","dir":"D","start":{"r":8,"c":7},"len":2,"clueCell":{"r":7,"c":7},"arrow":"D","clueId":"hc_f18841b2155e","lemmaId":"hw_c9529f5963","wordCount":1,"difficulty":0.114}],"solution":{"enc":"xor1","data":"K8Czvq2j8HZACFuo0YsawoXM5FytrIOhoy+v0ZKkMygUlWf5C/C70iEWCVW9WYyVEq3obr5cG/Y="},"difficulty":{"score":38.7,"band":"easy","features":{"meanWordDiff":0.309,"p90WordDiff":0.491,"meanClueDiff":0.476,"wordCount":25.0,"avgLen":4.04,"checkedRatio":0.804,"properShare":0.0,"multiwordShare":0.0,"bentArrows":4.0,"twoLetterShare":0.24,"uncheckedLetters":11.0}},"meta":{"generator":{"version":"0.2.1","seed":"dab63bf96f972b5941e280430489a028","templateId":"he-t2-031","dictSnapshot":"he-865d07520f"},"author":"generator","createdAt":"2026-10-29T09:43:09.547523Z","version":1,"checksum":"sha256:1219d78b662c33a8dd3ddc69e9f9e09bec006ca6df3527183d05beb14557a6da"}}