{"schemaVersion":1,"lang":"en","id":"en-l2-p01-07","kind":"pack","level":2,"pack":{"id":"en-l2-p01","index":7},"grid":{"rows":10,"cols":8,"colOrigin":"readingStart"},"layout":["CCCCCCCC","CLLLLLLL","CLCLLLCL","CLCLLLLL","CCCLLLLL","CLCCLLLL","CLLLLCLC","CLLLCLLL","CLLLCLLL","CLLLLLLL"],"clueCells":[{"r":0,"c":1,"slots":[{"pos":"full","wordId":"d01","arrow":"D","text":"sail with four corners","lines":["sail with","four","corners"]}]},{"r":0,"c":3,"slots":[{"pos":"full","wordId":"d04","arrow":"D","text":"trench","lines":["trench"]}]},{"r":0,"c":4,"slots":[{"pos":"full","wordId":"d06","arrow":"D","text":"halide","lines":["halide"]}]},{"r":0,"c":5,"slots":[{"pos":"full","wordId":"d07","arrow":"D","text":"letter","lines":["letter"]}]},{"r":0,"c":7,"slots":[{"pos":"full","wordId":"d10","arrow":"D","text":"tax","lines":["tax"]}]},{"r":1,"c":0,"slots":[{"pos":"full","wordId":"a01","arrow":"A","text":"circuit","lines":["circuit"]}]},{"r":2,"c":2,"slots":[{"pos":"full","wordId":"a02","arrow":"A","text":"aah","lines":["aah"]}]},{"r":2,"c":6,"slots":[{"pos":"full","wordId":"d09","arrow":"D","text":"enlisted man","lines":["enlisted","man"]}]},{"r":3,"c":2,"slots":[{"pos":"full","wordId":"a03","arrow":"A","text":"good","lines":["good"]}]},{"r":4,"c":1,"slots":[{"pos":"full","wordId":"d02","arrow":"D","text":"fade","lines":["fade"]}]},{"r":4,"c":2,"slots":[{"pos":"full","wordId":"a04","arrow":"A","text":"titer","lines":["titer"]}]},{"r":5,"c":2,"slots":[{"pos":"full","wordId":"d03","arrow":"D","text":"viva","lines":["viva"]}]},{"r":5,"c":3,"slots":[{"pos":"top","wordId":"a05","arrow":"A","text":"platform","lines":["platform"]},{"pos":"bottom","wordId":"d05","arrow":"D","text":"structure","lines":["structure"]}]},{"r":6,"c":0,"slots":[{"pos":"full","wordId":"a06","arrow":"A","text":"content","lines":["content"]}]},{"r":6,"c":5,"slots":[{"pos":"full","wordId":"d08","arrow":"D","text":"heated","lines":["heated"]}]},{"r":6,"c":7,"slots":[{"pos":"full","wordId":"d11","arrow":"D","text":"quarters","lines":["quarters"]}]},{"r":7,"c":0,"slots":[{"pos":"full","wordId":"a07","arrow":"A","text":"wrath","lines":["wrath"]}]},{"r":7,"c":4,"slots":[{"pos":"full","wordId":"a08","arrow":"A","text":"come to pass","lines":["come to","pass"]}]},{"r":8,"c":0,"slots":[{"pos":"full","wordId":"a09","arrow":"A","text":"feline","lines":["feline"]}]},{"r":8,"c":4,"slots":[{"pos":"full","wordId":"a10","arrow":"A","text":"letter","lines":["letter"]}]},{"r":9,"c":0,"slots":[{"pos":"full","wordId":"a11","arrow":"A","text":"elective","lines":["elective"]}]}],"words":[{"id":"a01","dir":"A","start":{"r":1,"c":1},"len":7,"clueCell":{"r":1,"c":0},"arrow":"A","clueId":"ec_3e07ebcf2676","lemmaId":"ew_838c0cccca","wordCount":1,"difficulty":0.494},{"id":"a02","dir":"A","start":{"r":2,"c":3},"len":3,"clueCell":{"r":2,"c":2},"arrow":"A","clueId":"ec_3adbbb64abe9","lemmaId":"ew_645916a519","wordCount":1,"difficulty":0.273},{"id":"a03","dir":"A","start":{"r":3,"c":3},"len":5,"clueCell":{"r":3,"c":2},"arrow":"A","clueId":"ec_532b94834354","lemmaId":"ew_bdc04d26a4","wordCount":1,"difficulty":0.346},{"id":"a04","dir":"A","start":{"r":4,"c":3},"len":5,"clueCell":{"r":4,"c":2},"arrow":"A","clueId":"ec_4ca011341ef6","lemmaId":"ew_8b6a312f13","wordCount":1,"difficulty":0.415},{"id":"a05","dir":"A","start":{"r":5,"c":4},"len":4,"clueCell":{"r":5,"c":3},"arrow":"A","clueId":"ec_4108b6ac945a","lemmaId":"ew_59f3fceee2","wordCount":1,"difficulty":0.508},{"id":"a06","dir":"A","start":{"r":6,"c":1},"len":4,"clueCell":{"r":6,"c":0},"arrow":"A","clueId":"ec_231ef8266b96","lemmaId":"ew_b65d0b2868","wordCount":1,"difficulty":0.301},{"id":"a07","dir":"A","start":{"r":7,"c":1},"len":3,"clueCell":{"r":7,"c":0},"arrow":"A","clueId":"ec_7e0a68307940","lemmaId":"ew_2271e86677","wordCount":1,"difficulty":0.271},{"id":"a08","dir":"A","start":{"r":7,"c":5},"len":3,"clueCell":{"r":7,"c":4},"arrow":"A","clueId":"ec_6f76fd809017","lemmaId":"ew_a531d61dfa","wordCount":1,"difficulty":0.31},{"id":"a09","dir":"A","start":{"r":8,"c":1},"len":3,"clueCell":{"r":8,"c":0},"arrow":"A","clueId":"ec_736e6e6d07db","lemmaId":"ew_9d989e8d27","wordCount":1,"difficulty":0.12},{"id":"a10","dir":"A","start":{"r":8,"c":5},"len":3,"clueCell":{"r":8,"c":4},"arrow":"A","clueId":"ec_aa200e748471","lemmaId":"ew_4e3b829410","wordCount":1,"difficulty":0.245},{"id":"a11","dir":"A","start":{"r":9,"c":1},"len":7,"clueCell":{"r":9,"c":0},"arrow":"A","clueId":"ec_df0b05a02856","lemmaId":"ew_7b1d05c6a7","wordCount":1,"difficulty":0.287},{"id":"d01","dir":"D","start":{"r":1,"c":1},"len":3,"clueCell":{"r":0,"c":1},"arrow":"D","clueId":"ec_b45f949a682a","lemmaId":"ew_48e08203a3","wordCount":1,"difficulty":0.256},{"id":"d02","dir":"D","start":{"r":5,"c":1},"len":5,"clueCell":{"r":4,"c":1},"arrow":"D","clueId":"ec_d34a63bd7d7c","lemmaId":"ew_0a5228e66d","wordCount":1,"difficulty":0.279},{"id":"d03","dir":"D","start":{"r":6,"c":2},"len":4,"clueCell":{"r":5,"c":2},"arrow":"D","clueId":"ec_f5f5da31ebbc","lemmaId":"ew_1a1fd23792","wordCount":1,"difficulty":0.156},{"id":"d04","dir":"D","start":{"r":1,"c":3},"len":4,"clueCell":{"r":0,"c":3},"arrow":"D","clueId":"ec_1bab42da565d","lemmaId":"ew_19013a7b1a","wordCount":1,"difficulty":0.394},{"id":"d05","dir":"D","start":{"r":6,"c":3},"len":4,"clueCell":{"r":5,"c":3},"arrow":"D","clueId":"ec_cf3f2ecac652","lemmaId":"ew_d307d20f4d","wordCount":1,"difficulty":0.422},{"id":"d06","dir":"D","start":{"r":1,"c":4},"len":6,"clueCell":{"r":0,"c":4},"arrow":"D","clueId":"ec_70e291d9e712","lemmaId":"ew_bdf93513af","wordCount":1,"difficulty":0.487},{"id":"d07","dir":"D","start":{"r":1,"c":5},"len":5,"clueCell":{"r":0,"c":5},"arrow":"D","clueId":"ec_7c0116223378","lemmaId":"ew_f24426b9ff","wordCount":1,"difficulty":0.274},{"id":"d08","dir":"D","start":{"r":7,"c":5},"len":3,"clueCell":{"r":6,"c":5},"arrow":"D","clueId":"ec_13d0e55f2a81","lemmaId":"ew_55e8f3f952","wordCount":1,"difficulty":0.21},{"id":"d09","dir":"D","start":{"r":3,"c":6},"len":7,"clueCell":{"r":2,"c":6},"arrow":"D","clueId":"ec_2dc05c898ae2","lemmaId":"ew_e80721793c","wordCount":1,"difficulty":0.219},{"id":"d10","dir":"D","start":{"r":1,"c":7},"len":5,"clueCell":{"r":0,"c":7},"arrow":"D","clueId":"ec_07ddbb641c8f","lemmaId":"ew_746650689d","wordCount":1,"difficulty":0.159},{"id":"d11","dir":"D","start":{"r":7,"c":7},"len":3,"clueCell":{"r":6,"c":7},"arrow":"D","clueId":"ec_8b020a31ad83","lemmaId":"ew_51da2df9f4","wordCount":1,"difficulty":0.162}],"solution":{"enc":"xor1","data":"tFO+7YoHnELCA7/6iExch+ca7FCc6v+j/Wj4kFw9gRtKpBlNYgPJKkYHLets0q1Jcliwlw=="},"difficulty":{"score":37.5,"band":"easy","features":{"meanWordDiff":0.299,"p90WordDiff":0.487,"meanClueDiff":0.524,"wordCount":22.0,"avgLen":4.364,"checkedRatio":0.846,"properShare":0.0,"multiwordShare":0.0,"bentArrows":0.0,"twoLetterShare":0.0,"uncheckedLetters":8.0}},"meta":{"generator":{"version":"0.2.0","seed":"bf6474b9f762466b1988145f1a81d52d","templateId":"en-t2-004","dictSnapshot":"en-9280a7165b"},"author":"generator","createdAt":"2026-10-28T22:58:40.348640Z","version":1,"checksum":"sha256:bbf6ecc0c4207f23c8738fa95703b711daafe7fff7641ad2812f06a21976881c"}}