{"schemaVersion":1,"lang":"en","id":"en-d-2026-11-08-easy","kind":"daily","level":2,"title":"Daily Arrowword","daily":{"date":"2026-11-08","variant":"easy"},"grid":{"rows":10,"cols":8,"colOrigin":"readingStart"},"layout":["CLLLCLCC","CLCCCLLL","LLLLCLLL","CLLLCLLL","CCLLLLLL","LLLLLCCC","CLCCLLLL","LLLLCLLL","CLLLCLLL","CLLLCLLL"],"clueCells":[{"r":0,"c":0,"slots":[{"pos":"top","wordId":"a01","arrow":"A","text":"drinker","lines":["drinker"]},{"pos":"bottom","wordId":"d01","arrow":"AD","text":"rack","lines":["rack"]}]},{"r":0,"c":4,"slots":[{"pos":"full","wordId":"d08","arrow":"AD","text":"path set aside for walking","lines":["path set","aside for","walking"]}]},{"r":0,"c":6,"slots":[{"pos":"full","wordId":"d10","arrow":"D","text":"age","lines":["age"]}]},{"r":0,"c":7,"slots":[{"pos":"full","wordId":"d12","arrow":"D","text":"terminal part","lines":["terminal","part"]}]},{"r":1,"c":0,"slots":[{"pos":"full","wordId":"a03","arrow":"DA","text":"part","lines":["part"]}]},{"r":1,"c":2,"slots":[{"pos":"full","wordId":"d03","arrow":"D","text":"missed","lines":["missed"]}]},{"r":1,"c":3,"slots":[{"pos":"full","wordId":"d05","arrow":"D","text":"biennial Eurasian plant","lines":["biennial","Eurasian","plant"]}]},{"r":1,"c":4,"slots":[{"pos":"full","wordId":"a02","arrow":"A","text":"ooh","lines":["ooh"]}]},{"r":2,"c":4,"slots":[{"pos":"full","wordId":"a04","arrow":"A","text":"water","lines":["water"]}]},{"r":3,"c":0,"slots":[{"pos":"full","wordId":"a05","arrow":"A","text":"mature female","lines":["mature","female"]}]},{"r":3,"c":4,"slots":[{"pos":"top","wordId":"a06","arrow":"A","text":"longest division","lines":["longest","division"]},{"pos":"bottom","wordId":"d07","arrow":"D","text":"swan","lines":["swan"]}]},{"r":4,"c":0,"slots":[{"pos":"full","wordId":"a08","arrow":"DA","text":"repeat","lines":["repeat"]}]},{"r":4,"c":1,"slots":[{"pos":"top","wordId":"a07","arrow":"A","text":"irregular","lines":["irregular"]},{"pos":"bottom","wordId":"d02","arrow":"D","text":"bond","lines":["bond"]}]},{"r":5,"c":5,"slots":[{"pos":"full","wordId":"d09","arrow":"D","text":"on, to, or at the top","lines":["on, to, or","at the","top"]}]},{"r":5,"c":6,"slots":[{"pos":"full","wordId":"d11","arrow":"D","text":"not widely known","lines":["not","widely","known"]}]},{"r":5,"c":7,"slots":[{"pos":"full","wordId":"d13","arrow":"D","text":"prepare by brewing","lines":["prepare","by","brewing"]}]},{"r":6,"c":0,"slots":[{"pos":"full","wordId":"a10","arrow":"DA","text":"stupid foolish person","lines":["stupid","foolish","person"]}]},{"r":6,"c":2,"slots":[{"pos":"full","wordId":"d04","arrow":"D","text":"any of a group","lines":["any of a","group"]}]},{"r":6,"c":3,"slots":[{"pos":"top","wordId":"a09","arrow":"A","text":"point","lines":["point"]},{"pos":"bottom","wordId":"d06","arrow":"D","text":"use diligently","lines":["use","diligently"]}]},{"r":7,"c":4,"slots":[{"pos":"full","wordId":"a11","arrow":"A","text":"seaman","lines":["seaman"]}]},{"r":8,"c":0,"slots":[{"pos":"full","wordId":"a12","arrow":"A","text":"nada","lines":["nada"]}]},{"r":8,"c":4,"slots":[{"pos":"full","wordId":"a13","arrow":"A","text":"mineral","lines":["mineral"]}]},{"r":9,"c":0,"slots":[{"pos":"full","wordId":"a14","arrow":"A","text":"wily","lines":["wily"]}]},{"r":9,"c":4,"slots":[{"pos":"full","wordId":"a15","arrow":"A","text":"bench","lines":["bench"]}]}],"words":[{"id":"a01","dir":"A","start":{"r":0,"c":1},"len":3,"clueCell":{"r":0,"c":0},"arrow":"A","clueId":"ec_58e64ffd4f0b","lemmaId":"ew_bb6c237f32","wordCount":1,"difficulty":0.36},{"id":"a02","dir":"A","start":{"r":1,"c":5},"len":3,"clueCell":{"r":1,"c":4},"arrow":"A","clueId":"ec_f09b0daf800f","lemmaId":"ew_714a417a8a","wordCount":1,"difficulty":0.415},{"id":"a03","dir":"A","start":{"r":2,"c":0},"len":4,"clueCell":{"r":1,"c":0},"arrow":"DA","clueId":"ec_e7ec8bddb6bc","lemmaId":"ew_7ca6c1515a","wordCount":1,"difficulty":0.243},{"id":"a04","dir":"A","start":{"r":2,"c":5},"len":3,"clueCell":{"r":2,"c":4},"arrow":"A","clueId":"ec_9477dfbfb955","lemmaId":"ew_6fa11fb296","wordCount":1,"difficulty":0.112},{"id":"a05","dir":"A","start":{"r":3,"c":1},"len":3,"clueCell":{"r":3,"c":0},"arrow":"A","clueId":"ec_47aae086ce07","lemmaId":"ew_d6b4e84ee7","wordCount":1,"difficulty":0.185},{"id":"a06","dir":"A","start":{"r":3,"c":5},"len":3,"clueCell":{"r":3,"c":4},"arrow":"A","clueId":"ec_4203f6fe6e55","lemmaId":"ew_6799ed0b29","wordCount":1,"difficulty":0.351},{"id":"a07","dir":"A","start":{"r":4,"c":2},"len":6,"clueCell":{"r":4,"c":1},"arrow":"A","clueId":"ec_14319a1a5e53","lemmaId":"ew_352f7829a2","wordCount":1,"difficulty":0.19},{"id":"a08","dir":"A","start":{"r":5,"c":0},"len":5,"clueCell":{"r":4,"c":0},"arrow":"DA","clueId":"ec_5035ceeacf71","lemmaId":"ew_c9e7a66afb","wordCount":1,"difficulty":0.356},{"id":"a09","dir":"A","start":{"r":6,"c":4},"len":4,"clueCell":{"r":6,"c":3},"arrow":"A","clueId":"ec_7a67b8efbe96","lemmaId":"ew_2e5cd71663","wordCount":1,"difficulty":0.288},{"id":"a10","dir":"A","start":{"r":7,"c":0},"len":4,"clueCell":{"r":6,"c":0},"arrow":"DA","clueId":"ec_cfb60a794712","lemmaId":"ew_81b06facd9","wordCount":1,"difficulty":0.313},{"id":"a11","dir":"A","start":{"r":7,"c":5},"len":3,"clueCell":{"r":7,"c":4},"arrow":"A","clueId":"ec_60bd64d1db0a","lemmaId":"ew_680254bad1","wordCount":1,"difficulty":0.192},{"id":"a12","dir":"A","start":{"r":8,"c":1},"len":3,"clueCell":{"r":8,"c":0},"arrow":"A","clueId":"ec_9207b392ba81","lemmaId":"ew_b5366a2d2a","wordCount":1,"difficulty":0.202},{"id":"a13","dir":"A","start":{"r":8,"c":5},"len":3,"clueCell":{"r":8,"c":4},"arrow":"A","clueId":"ec_29487bb23603","lemmaId":"ew_e185d5eeb9","wordCount":1,"difficulty":0.234},{"id":"a14","dir":"A","start":{"r":9,"c":1},"len":3,"clueCell":{"r":9,"c":0},"arrow":"A","clueId":"ec_43c0d3a7286d","lemmaId":"ew_8b2e03a72a","wordCount":1,"difficulty":0.298},{"id":"a15","dir":"A","start":{"r":9,"c":5},"len":3,"clueCell":{"r":9,"c":4},"arrow":"A","clueId":"ec_1466b9128a24","lemmaId":"ew_e173e39778","wordCount":1,"difficulty":0.306},{"id":"d01","dir":"D","start":{"r":0,"c":1},"len":4,"clueCell":{"r":0,"c":0},"arrow":"AD","clueId":"ec_aa3db974a847","lemmaId":"ew_299d236668","wordCount":1,"difficulty":0.479},{"id":"d02","dir":"D","start":{"r":5,"c":1},"len":5,"clueCell":{"r":4,"c":1},"arrow":"D","clueId":"ec_99a3d6ba7eb8","lemmaId":"ew_23a156b7de","wordCount":1,"difficulty":0.301},{"id":"d03","dir":"D","start":{"r":2,"c":2},"len":4,"clueCell":{"r":1,"c":2},"arrow":"D","clueId":"ec_4c0bc9037b26","lemmaId":"ew_2010281d50","wordCount":1,"difficulty":0.14},{"id":"d04","dir":"D","start":{"r":7,"c":2},"len":3,"clueCell":{"r":6,"c":2},"arrow":"D","clueId":"ec_1e4acc4db398","lemmaId":"ew_a5f58c39cc","wordCount":1,"difficulty":0.104},{"id":"d05","dir":"D","start":{"r":2,"c":3},"len":4,"clueCell":{"r":1,"c":3},"arrow":"D","clueId":"ec_90f184bb78fe","lemmaId":"ew_ff81315b7f","wordCount":1,"difficulty":0.365},{"id":"d06","dir":"D","start":{"r":7,"c":3},"len":3,"clueCell":{"r":6,"c":3},"arrow":"D","clueId":"ec_943f6b138459","lemmaId":"ew_261313d89f","wordCount":1,"difficulty":0.269},{"id":"d07","dir":"D","start":{"r":4,"c":4},"len":3,"clueCell":{"r":3,"c":4},"arrow":"D","clueId":"ec_45ab483c8684","lemmaId":"ew_72a008c473","wordCount":1,"difficulty":0.312},{"id":"d08","dir":"D","start":{"r":0,"c":5},"len":5,"clueCell":{"r":0,"c":4},"arrow":"AD","clueId":"ec_9a99a3da07ec","lemmaId":"ew_dae2f72e04","wordCount":1,"difficulty":0.397},{"id":"d09","dir":"D","start":{"r":6,"c":5},"len":4,"clueCell":{"r":5,"c":5},"arrow":"D","clueId":"ec_5ca0dcf586f1","lemmaId":"ew_c4e6a48966","wordCount":1,"difficulty":0.314},{"id":"d10","dir":"D","start":{"r":1,"c":6},"len":4,"clueCell":{"r":0,"c":6},"arrow":"D","clueId":"ec_ac059c617c2a","lemmaId":"ew_4bb2020125","wordCount":1,"difficulty":0.358},{"id":"d11","dir":"D","start":{"r":6,"c":6},"len":4,"clueCell":{"r":5,"c":6},"arrow":"D","clueId":"ec_8955bd5c6719","lemmaId":"ew_d5e62fc1fc","wordCount":1,"difficulty":0.167},{"id":"d12","dir":"D","start":{"r":1,"c":7},"len":4,"clueCell":{"r":0,"c":7},"arrow":"D","clueId":"ec_76a2f23e58b4","lemmaId":"ew_9621a244a4","wordCount":1,"difficulty":0.129},{"id":"d13","dir":"D","start":{"r":6,"c":7},"len":4,"clueCell":{"r":5,"c":7},"arrow":"D","clueId":"ec_9386f8930485","lemmaId":"ew_b6fc12d785","wordCount":1,"difficulty":0.284}],"solution":{"enc":"xor1","data":"zCxw4oc8eBenTlbBfG35GlX1A1S9ulMNkBFALYkYLdcT5NYpPR5k4KE+5jYdQfuZL7eHFb8w9IM="},"difficulty":{"score":38.2,"band":"easy","features":{"meanWordDiff":0.274,"p90WordDiff":0.365,"meanClueDiff":0.552,"wordCount":28.0,"avgLen":3.714,"checkedRatio":0.857,"properShare":0.0,"multiwordShare":0.0,"bentArrows":5.0,"twoLetterShare":0.0,"uncheckedLetters":8.0}},"meta":{"generator":{"version":"0.2.1","seed":"93d04ce60802b86d76464740749ea00c","templateId":"en-t2-023","dictSnapshot":"en-9280a7165b"},"author":"generator","createdAt":"2026-10-29T10:04:35.510073Z","version":1,"checksum":"sha256:4ca454b744feac8a333684beaaa14fd46ceff01576a923962d3678ec3e90dd14"}}