{"schemaVersion":1,"lang":"he","id":"he-d-2026-12-25-easy","kind":"daily","level":2,"title":"התשחץ היומי","daily":{"date":"2026-12-25","variant":"easy"},"grid":{"rows":10,"cols":8,"colOrigin":"readingStart"},"layout":["CCCCCLCC","CLLLLLLL","CLLCCCLC","CLLLLLCL","CCCLLLLL","CLLLCLLL","CLCLLLCL","CLCLCLLL","CLLLCLLL","CLLLLLLL"],"clueCells":[{"r":0,"c":1,"slots":[{"pos":"full","wordId":"d01","arrow":"D","text":"תבנית קבועה","lines":["תבנית","קבועה"]}]},{"r":0,"c":2,"slots":[{"pos":"full","wordId":"d03","arrow":"D","text":"הלך מסביב","lines":["הלך","מסביב"]}]},{"r":0,"c":4,"slots":[{"pos":"full","wordId":"d07","arrow":"AD","text":"פיטמת השד","lines":["פיטמת","השד"]}]},{"r":0,"c":6,"slots":[{"pos":"full","wordId":"d09","arrow":"D","text":"אנוש","lines":["אנוש"]}]},{"r":1,"c":0,"slots":[{"pos":"full","wordId":"a01","arrow":"A","text":"של עכשיו (בארמית)","lines":["של עכשיו","(בארמית)"]}]},{"r":2,"c":0,"slots":[{"pos":"full","wordId":"a02","arrow":"A","text":"בחפיסת הקלפים","lines":["בחפיסת","הקלפים"]}]},{"r":2,"c":3,"slots":[{"pos":"full","wordId":"d05","arrow":"D","text":"משתלם מבחינה כלכלית","lines":["משתלם","מבחינה","כלכלית"]}]},{"r":2,"c":4,"slots":[{"pos":"full","wordId":"d06","arrow":"D","text":"זקן","lines":["זקן"]}]},{"r":2,"c":5,"slots":[{"pos":"full","wordId":"d08","arrow":"D","text":"הורמון החושך","lines":["הורמון","החושך"]}]},{"r":2,"c":7,"slots":[{"pos":"full","wordId":"d12","arrow":"D","text":"סדרת אנימציה ישנה","lines":["סדרת","אנימציה","ישנה"]}]},{"r":3,"c":0,"slots":[{"pos":"full","wordId":"a03","arrow":"A","text":"מפיץ מודעות","lines":["מפיץ","מודעות"]}]},{"r":3,"c":6,"slots":[{"pos":"full","wordId":"d10","arrow":"D","text":"באיטיות","lines":["באיטיות"]}]},{"r":4,"c":1,"slots":[{"pos":"full","wordId":"d02","arrow":"D","text":"נעשה כפוף","lines":["נעשה","כפוף"]}]},{"r":4,"c":2,"slots":[{"pos":"full","wordId":"a04","arrow":"A","text":"אחד מחברי התזמורת","lines":["אחד","מחברי","התזמורת"]}]},{"r":5,"c":0,"slots":[{"pos":"full","wordId":"a05","arrow":"A","text":"העברת כוחות דרך הים","lines":["העברת","כוחות דרך","הים"]}]},{"r":5,"c":4,"slots":[{"pos":"full","wordId":"a06","arrow":"A","text":"סוג של ארמדיל","lines":["סוג של","ארמדיל"]}]},{"r":6,"c":2,"slots":[{"pos":"full","wordId":"a07","arrow":"A","text":"מספרי יורם קניוק","lines":["מספרי","יורם קניוק"]}]},{"r":6,"c":6,"slots":[{"pos":"full","wordId":"d11","arrow":"D","text":"מראה עיניים","lines":["מראה","עיניים"]}]},{"r":7,"c":2,"slots":[{"pos":"full","wordId":"d04","arrow":"D","text":"דיודה פולטת אור, בלעז","lines":["דיודה","פולטת","אור, בלעז"]}]},{"r":7,"c":4,"slots":[{"pos":"full","wordId":"a08","arrow":"A","text":"חיה מסורבלת","lines":["חיה","מסורבלת"]}]},{"r":8,"c":0,"slots":[{"pos":"full","wordId":"a09","arrow":"A","text":"דבר מלוטש ומבריק","lines":["דבר","מלוטש","ומבריק"]}]},{"r":8,"c":4,"slots":[{"pos":"full","wordId":"a10","arrow":"A","text":"אחי הבעל גיס","lines":["אחי הבעל","גיס"]}]},{"r":9,"c":0,"slots":[{"pos":"full","wordId":"a11","arrow":"A","text":"דרגה בסולם מוזיקלי","lines":["דרגה","בסולם","מוזיקלי"]}]}],"words":[{"id":"a01","dir":"A","start":{"r":1,"c":1},"len":7,"clueCell":{"r":1,"c":0},"arrow":"A","clueId":"hc_b629ba8bf18d","lemmaId":"hw_f3cd659d6a","wordCount":1,"difficulty":0.341},{"id":"a02","dir":"A","start":{"r":2,"c":1},"len":2,"clueCell":{"r":2,"c":0},"arrow":"A","clueId":"hc_170a00868237","lemmaId":"hw_985aa755ca","wordCount":1,"difficulty":0.38},{"id":"a03","dir":"A","start":{"r":3,"c":1},"len":5,"clueCell":{"r":3,"c":0},"arrow":"A","clueId":"hc_f853b22463a7","lemmaId":"hw_8e0cf773fd","wordCount":1,"difficulty":0.196},{"id":"a04","dir":"A","start":{"r":4,"c":3},"len":5,"clueCell":{"r":4,"c":2},"arrow":"A","clueId":"hc_0dbccb1d9a15","lemmaId":"hw_e05b6155cf","wordCount":1,"difficulty":0.227},{"id":"a05","dir":"A","start":{"r":5,"c":1},"len":3,"clueCell":{"r":5,"c":0},"arrow":"A","clueId":"hc_cbe784e63d4a","lemmaId":"hw_6adb38c320","wordCount":1,"difficulty":0.38},{"id":"a06","dir":"A","start":{"r":5,"c":5},"len":3,"clueCell":{"r":5,"c":4},"arrow":"A","clueId":"hc_930db453c9b4","lemmaId":"hw_6557e7f8b8","wordCount":1,"difficulty":0.283},{"id":"a07","dir":"A","start":{"r":6,"c":3},"len":3,"clueCell":{"r":6,"c":2},"arrow":"A","clueId":"hc_9d7e991d9f88","lemmaId":"hw_e542b196f3","wordCount":1,"difficulty":0.283},{"id":"a08","dir":"A","start":{"r":7,"c":5},"len":3,"clueCell":{"r":7,"c":4},"arrow":"A","clueId":"hc_f3ae7abd87bc","lemmaId":"hw_d1cca09567","wordCount":1,"difficulty":0.078},{"id":"a09","dir":"A","start":{"r":8,"c":1},"len":3,"clueCell":{"r":8,"c":0},"arrow":"A","clueId":"hc_7ffc279b8152","lemmaId":"hw_57130064dd","wordCount":1,"difficulty":0.283},{"id":"a10","dir":"A","start":{"r":8,"c":5},"len":3,"clueCell":{"r":8,"c":4},"arrow":"A","clueId":"hc_f40faae61c66","lemmaId":"hw_650fafdc3e","wordCount":1,"difficulty":0.23},{"id":"a11","dir":"A","start":{"r":9,"c":1},"len":7,"clueCell":{"r":9,"c":0},"arrow":"A","clueId":"hc_a90b606a684b","lemmaId":"hw_c92df28f98","wordCount":1,"difficulty":0.491},{"id":"d01","dir":"D","start":{"r":1,"c":1},"len":3,"clueCell":{"r":0,"c":1},"arrow":"D","clueId":"hc_64f29b9e26b3","lemmaId":"hw_8e43150108","wordCount":1,"difficulty":0.283},{"id":"d02","dir":"D","start":{"r":5,"c":1},"len":5,"clueCell":{"r":4,"c":1},"arrow":"D","clueId":"hc_9826b46ad813","lemmaId":"hw_b0f790c53b","wordCount":1,"difficulty":0.339},{"id":"d03","dir":"D","start":{"r":1,"c":2},"len":3,"clueCell":{"r":0,"c":2},"arrow":"D","clueId":"hc_120ac9e061ec","lemmaId":"hw_bd983d8895","wordCount":1,"difficulty":0.514},{"id":"d04","dir":"D","start":{"r":8,"c":2},"len":2,"clueCell":{"r":7,"c":2},"arrow":"D","clueId":"hc_cf55e82180c5","lemmaId":"hw_4f0b1a7808","wordCount":1,"difficulty":0.172},{"id":"d05","dir":"D","start":{"r":3,"c":3},"len":7,"clueCell":{"r":2,"c":3},"arrow":"D","clueId":"hc_132a0a811030","lemmaId":"hw_6a18081bd8","wordCount":1,"difficulty":0.306},{"id":"d06","dir":"D","start":{"r":3,"c":4},"len":2,"clueCell":{"r":2,"c":4},"arrow":"D","clueId":"hc_00b9f736fc57","lemmaId":"hw_b99ff84920","wordCount":1,"difficulty":0.088},{"id":"d07","dir":"D","start":{"r":0,"c":5},"len":2,"clueCell":{"r":0,"c":4},"arrow":"AD","clueId":"hc_9aa131ac7234","lemmaId":"hw_bcf10f8189","wordCount":1,"difficulty":0.514},{"id":"d08","dir":"D","start":{"r":3,"c":5},"len":7,"clueCell":{"r":2,"c":5},"arrow":"D","clueId":"hc_cb1d39d03fc0","lemmaId":"hw_fc8bd708c7","wordCount":1,"difficulty":0.491},{"id":"d09","dir":"D","start":{"r":1,"c":6},"len":2,"clueCell":{"r":0,"c":6},"arrow":"D","clueId":"hc_5dbe58773b73","lemmaId":"hw_b21f6d9782","wordCount":1,"difficulty":0.23},{"id":"d10","dir":"D","start":{"r":4,"c":6},"len":2,"clueCell":{"r":3,"c":6},"arrow":"D","clueId":"hc_4f33ca9830a0","lemmaId":"hw_8e22a3f68e","wordCount":1,"difficulty":0.172},{"id":"d11","dir":"D","start":{"r":7,"c":6},"len":3,"clueCell":{"r":6,"c":6},"arrow":"D","clueId":"hc_029637107354","lemmaId":"hw_c12f96a2ff","wordCount":1,"difficulty":0.098},{"id":"d12","dir":"D","start":{"r":3,"c":7},"len":7,"clueCell":{"r":2,"c":7},"arrow":"D","clueId":"hc_d37af3d79e7f","lemmaId":"hw_93506d45dc","wordCount":1,"difficulty":0.391}],"solution":{"enc":"xor1","data":"pgu0pvMY2P6q3ulrOMYWBcvcX5L6QueRRJCFPgXD3f7W/sNV7TwqY01hlb9NmwH/5LDa"},"difficulty":{"score":29.0,"band":"easy","features":{"meanWordDiff":0.294,"p90WordDiff":0.491,"meanClueDiff":0.467,"wordCount":23.0,"avgLen":3.87,"checkedRatio":0.745,"properShare":0.0,"multiwordShare":0.0,"bentArrows":1.0,"twoLetterShare":0.261,"uncheckedLetters":13.0}},"meta":{"generator":{"version":"0.2.0","seed":"bd011d1984630bdf6a372a9b0a70083b","templateId":"he-t2-013","dictSnapshot":"he-865d07520f"},"author":"generator","createdAt":"2026-10-28T23:19:44.135518Z","version":1,"checksum":"sha256:d444d978b77b7ab858d1b51eafb17e71f8eecc6cf4bbfa430714e84f43c75ae8"}}