{"schemaVersion":1,"lang":"he","id":"he-l1-p01-18","kind":"pack","level":1,"pack":{"id":"he-l1-p01","index":18},"grid":{"rows":9,"cols":7,"colOrigin":"readingStart"},"layout":["CCCCCCC","CLLLLLL","CLCLCCL","CLLLLLL","CLLLLLL","CCLCLCL","CLLLLLC","CLCLLLL","CLCLLLL"],"clueCells":[{"r":0,"c":1,"slots":[{"pos":"full","wordId":"d01","arrow":"D","text":"איזור באפריקה","lines":["איזור","באפריקה"]}]},{"r":0,"c":3,"slots":[{"pos":"full","wordId":"d04","arrow":"D","text":"לשוא","lines":["לשוא"]}]},{"r":0,"c":6,"slots":[{"pos":"full","wordId":"d09","arrow":"D","text":"חגורה רחבה","lines":["חגורה","רחבה"]}]},{"r":1,"c":0,"slots":[{"pos":"full","wordId":"a01","arrow":"A","text":"הכאה","lines":["הכאה"]}]},{"r":2,"c":2,"slots":[{"pos":"full","wordId":"d03","arrow":"D","text":"עמעם (בלעז)","lines":["עמעם","(בלעז)"]}]},{"r":2,"c":4,"slots":[{"pos":"full","wordId":"d06","arrow":"D","text":"סוג של צמח רעיל","lines":["סוג של","צמח רעיל"]}]},{"r":2,"c":5,"slots":[{"pos":"full","wordId":"d07","arrow":"D","text":"נשאר למשך הלילה","lines":["נשאר","למשך","הלילה"]}]},{"r":3,"c":0,"slots":[{"pos":"full","wordId":"a02","arrow":"A","text":"קיצוני","lines":["קיצוני"]}]},{"r":4,"c":0,"slots":[{"pos":"full","wordId":"a03","arrow":"A","text":"סוג של בגד ים לנשים","lines":["סוג של","בגד ים","לנשים"]}]},{"r":5,"c":1,"slots":[{"pos":"full","wordId":"d02","arrow":"D","text":"גזל","lines":["גזל"]}]},{"r":5,"c":3,"slots":[{"pos":"full","wordId":"d05","arrow":"D","text":"גרם לבלייה","lines":["גרם","לבלייה"]}]},{"r":5,"c":5,"slots":[{"pos":"full","wordId":"d08","arrow":"D","text":"נוזל בפה, רוק","lines":["נוזל בפה,","רוק"]}]},{"r":6,"c":0,"slots":[{"pos":"full","wordId":"a04","arrow":"A","text":"מן עוף","lines":["מן עוף"]}]},{"r":6,"c":6,"slots":[{"pos":"full","wordId":"d10","arrow":"D","text":"קרקע בגוון צהבהב","lines":["קרקע","בגוון","צהבהב"]}]},{"r":7,"c":2,"slots":[{"pos":"full","wordId":"a05","arrow":"A","text":"הובא לשורות הצבא גויס","lines":["הובא","לשורות","הצבא גויס"]}]},{"r":8,"c":2,"slots":[{"pos":"full","wordId":"a06","arrow":"A","text":"ירק מאכל, ארטישוק","lines":["ירק","מאכל,","ארטישוק"]}]}],"words":[{"id":"a01","dir":"A","start":{"r":1,"c":1},"len":6,"clueCell":{"r":1,"c":0},"arrow":"A","clueId":"hc_958077a607e3","lemmaId":"hw_f5c9853a18","wordCount":1,"difficulty":0.182},{"id":"a02","dir":"A","start":{"r":3,"c":1},"len":6,"clueCell":{"r":3,"c":0},"arrow":"A","clueId":"hc_eed78a4e4ac0","lemmaId":"hw_fd703dd435","wordCount":1,"difficulty":0.238},{"id":"a03","dir":"A","start":{"r":4,"c":1},"len":6,"clueCell":{"r":4,"c":0},"arrow":"A","clueId":"hc_5398a066027e","lemmaId":"hw_ea87a2640b","wordCount":1,"difficulty":0.205},{"id":"a04","dir":"A","start":{"r":6,"c":1},"len":5,"clueCell":{"r":6,"c":0},"arrow":"A","clueId":"hc_0aab11e6d71d","lemmaId":"hw_d1b775076d","wordCount":1,"difficulty":0.196},{"id":"a05","dir":"A","start":{"r":7,"c":3},"len":4,"clueCell":{"r":7,"c":2},"arrow":"A","clueId":"hc_6958baf4bdbe","lemmaId":"hw_15ddff313a","wordCount":1,"difficulty":0.408},{"id":"a06","dir":"A","start":{"r":8,"c":3},"len":4,"clueCell":{"r":8,"c":2},"arrow":"A","clueId":"hc_bffebd31a1db","lemmaId":"hw_391ac188de","wordCount":1,"difficulty":0.258},{"id":"d01","dir":"D","start":{"r":1,"c":1},"len":4,"clueCell":{"r":0,"c":1},"arrow":"D","clueId":"hc_515e3529a9bc","lemmaId":"hw_016ad5f239","wordCount":1,"difficulty":0.311},{"id":"d02","dir":"D","start":{"r":6,"c":1},"len":3,"clueCell":{"r":5,"c":1},"arrow":"D","clueId":"hc_c86551b2af27","lemmaId":"hw_1f74244997","wordCount":1,"difficulty":0.195},{"id":"d03","dir":"D","start":{"r":3,"c":2},"len":4,"clueCell":{"r":2,"c":2},"arrow":"D","clueId":"hc_3951d03da8ab","lemmaId":"hw_024109b991","wordCount":1,"difficulty":0.223},{"id":"d04","dir":"D","start":{"r":1,"c":3},"len":4,"clueCell":{"r":0,"c":3},"arrow":"D","clueId":"hc_4fb2083d9cdb","lemmaId":"hw_5058c1b380","wordCount":1,"difficulty":0.158},{"id":"d05","dir":"D","start":{"r":6,"c":3},"len":3,"clueCell":{"r":5,"c":3},"arrow":"D","clueId":"hc_0373278f04dd","lemmaId":"hw_5c16791d08","wordCount":1,"difficulty":0.114},{"id":"d06","dir":"D","start":{"r":3,"c":4},"len":6,"clueCell":{"r":2,"c":4},"arrow":"D","clueId":"hc_8bb0344bafee","lemmaId":"hw_386bcfa1ed","wordCount":1,"difficulty":0.279},{"id":"d07","dir":"D","start":{"r":3,"c":5},"len":2,"clueCell":{"r":2,"c":5},"arrow":"D","clueId":"hc_df8bf5b41d6d","lemmaId":"hw_1a6d23022c","wordCount":1,"difficulty":0.141},{"id":"d08","dir":"D","start":{"r":6,"c":5},"len":3,"clueCell":{"r":5,"c":5},"arrow":"D","clueId":"hc_7f6a61de3300","lemmaId":"hw_78fe135258","wordCount":1,"difficulty":0.121},{"id":"d09","dir":"D","start":{"r":1,"c":6},"len":5,"clueCell":{"r":0,"c":6},"arrow":"D","clueId":"hc_def513121b0c","lemmaId":"hw_585101bc8d","wordCount":1,"difficulty":0.286},{"id":"d10","dir":"D","start":{"r":7,"c":6},"len":2,"clueCell":{"r":6,"c":6},"arrow":"D","clueId":"hc_5516b2f2f548","lemmaId":"hw_bf4fa67b05","wordCount":1,"difficulty":0.121}],"solution":{"enc":"xor1","data":"xIIQSw9PwSoo+DoeIRIBKWEQMAj8yDmX2CpOhHsXFhZxMFLZJ//I"},"difficulty":{"score":21.0,"band":"easy","features":{"meanWordDiff":0.215,"p90WordDiff":0.311,"meanClueDiff":0.398,"wordCount":16.0,"avgLen":4.188,"checkedRatio":0.718,"properShare":0.0,"multiwordShare":0.0,"bentArrows":0.0,"twoLetterShare":0.125,"uncheckedLetters":11.0}},"meta":{"generator":{"version":"0.1.0","seed":"2229afbfadcb9176a6c1b0bb1e3a122f","templateId":"he-t1-029","dictSnapshot":"he-865d07520f"},"author":"generator","createdAt":"2026-10-28T22:44:47.398275Z","version":1,"checksum":"sha256:444bfacf94372a7ae491cdf6fd040647bbd82270a13396a46c41ced8598887f2"}}